{
  "format": "mdaf",
  "version": 1,
  "title": "Synthetic Rules",
  "markdown": {
    "path": "text.md",
    "digest": "blake3:4a1966cd5757837f2c4135aa22c0109ef79f2969bef69d4f9055845c7df9a55a",
    "media_type": "text/markdown"
  },
  "producer": {
    "name": "example-producer",
    "version": "1.0.0"
  },
  "members": [
    {
      "path": "text.md",
      "role": "primary",
      "media_type": "text/markdown",
      "size": 56,
      "digest": "blake3:4a1966cd5757837f2c4135aa22c0109ef79f2969bef69d4f9055845c7df9a55a",
      "created_by": "activity:extract"
    },
    {
      "path": "assets/map.txt",
      "role": "asset",
      "media_type": "text/plain",
      "size": 16,
      "digest": "blake3:57504e39e45eb0f4d40941efb44eaa2a7ae14ecf8d5f7629ec167561b79d35fa",
      "created_by": "activity:extract"
    },
    {
      "path": "source-map.json",
      "role": "source-map",
      "media_type": "application/json",
      "size": 2187,
      "digest": "blake3:5ab631e07f6c6f330a5b8a826aee8d44301597c51ff52e7d9ce266e442a3d277",
      "created_by": "activity:extract"
    },
    {
      "path": "outline.json",
      "role": "outline",
      "media_type": "application/json",
      "size": 559,
      "digest": "blake3:34e7125455cf229a78920192f8f1f7bcadb22fa124a87e93e84a9dcea7ea7ff8",
      "created_by": "activity:extract"
    },
    {
      "path": "provenance.json",
      "role": "provenance",
      "media_type": "application/json",
      "size": 825,
      "digest": "blake3:5c885a02f9fda24336974a7249716cb3800bb9ef99a6ea4086f2e6968db80146",
      "created_by": "activity:extract"
    }
  ],
  "sources": [
    {
      "id": "synthetic-image",
      "media_type": "image/png",
      "digest": "blake3:50ed94c4bf9660f33d2a4ef7452f74e116c30a826bee16164368b43fdede962b",
      "name": "synthetic-image.png"
    },
    {
      "id": "synthetic-audio",
      "media_type": "audio/wav",
      "digest": "blake3:86677defdb08acfd1c9a36db6ad61242c238b9fc9f15f7d0f7defa8830533ae8",
      "name": "synthetic-audio.wav"
    },
    {
      "id": "synthetic-sheet",
      "media_type": "text/csv",
      "digest": "blake3:f18603d2fc1dd51d78ee666b30195ca75ff193a9436d8c95a54fd0ba2bb907a5",
      "name": "synthetic-sheet.csv"
    },
    {
      "id": "synthetic-html",
      "media_type": "text/html",
      "digest": "blake3:99ef68041647d7bc1aef72dbf1934a0626575a174f7d12cd11743fa3162b904d",
      "name": "synthetic-page.html"
    }
  ],
  "capabilities": [
    "source-map",
    "outline"
  ]
}
